<?xml version="1.0" encoding="utf-8"?>
<scene xmlns:xsi="http://www.w3.org/2001/XMLSchema-instance" xsi:noNamespaceSchemaLocation="scene.xsd">
	<points>
		<point>
			<id>1</id>
			<x>-1.8</x>
			<y>-1.8</y>
			<z>0</z>
		</point>
		<point>
			<id>2</id>
			<x>1.8</x>
			<y>-1.8</y>
			<z>0</z>
		</point>
		<point>
			<id>3</id>
			<x>0</x>
			<y>1.8</y>
			<z>0</z>
		</point>
		<point>
			<id>4</id>
			<x>0</x>
			<y>0</y>
			<z>1.2</z>
		</point>
	</points>
	<faces>
		<face>
			<id>1</id>
			<point-id>1</point-id>
			<point-id>2</point-id>
			<point-id>3</point-id>
		</face>
		<face>
			<id>2</id>
			<point-id>1</point-id>
			<point-id>2</point-id>
			<point-id>4</point-id>
		</face>
		<face>
			<id>3</id>
			<point-id>1</point-id>
			<point-id>4</point-id>
			<point-id>3</point-id>
		</face>
		<face>
			<id>4</id>
			<point-id>4</point-id>
			<point-id>2</point-id>
			<point-id>3</point-id>
		</face>
	</faces>
	<objects>
		<object>
			<name>pyramid</name>
			<face-id>1</face-id>
			<face-id>2</face-id>
			<face-id>3</face-id>
			<face-id>4</face-id>
		</object>
	</objects>
</scene>
